Time,F_Scale,Location,County,State,Lat,Lon,Comments
2102,UNK,7 ENE Muleshoe Wildlife,Bailey,TX,33.97,-102.63,Multiple reports of a large multi-vortex tornado. (LUB)
2155,UNK,6 WNW Littlefield,Lamb,TX,33.95,-102.43,Reports of cyclical tornado by Lamb SO and spotters. (LUB)
2201,UNK,6 ENE Blytheville,Mississippi,AR,35.98,-89.82,[Landspout] A brief landspout formed in an open field northeast of Blytheville. No damage was observed. (MEG)
2332,UNK,3 NNE Greenville,Darke,OH,40.14,-84.62,EF0 tornado confirmed north of Greenville... Ohio. Minor damage to a structure with estimated winds of 65 MPH. (ILN)
0332,UNK,8 ENE Bootleg,Deaf Smith,TX,34.85,-102.67,Fire fighter dispatch reports a tornado viewing from the intersection of FM 1058 and FM 1057. (AMA)
0436,UNK,2 NNW Canyon,Randall,TX,35,-101.93,Preliminary report; noted debris in church parking lot across the street from the location reported. (AMA)
0735,UNK,7 SW Hart,Castro,TX,34.33,-102.2,(LUB)
0800,UNK,4 W Hart,Castro,TX,34.38,-102.18,(LUB)
